{
  "schemaVersion": "1.0.0",
  "runId": "2026-08-08-v1-export-fixture",
  "status": "stopped",
  "startedAt": "2026-08-08T00:00:00Z",
  "completedAt": "2026-08-08T00:00:01Z",
  "docket": { "title": "Historical export fixture" },
  "panel": { "id": "executioner-only" },
  "seats": [{ "id": "executioner" }],
  "stagesCompleted": ["docket-opening"],
  "testimonies": [],
  "crossExaminations": [],
  "stopReason": "fixture stop",
  "artifactPaths": ["record.json", "receipt.json"]
}
